filename,number,role,character,text
projects/OrionEp11/サウンド類/Narration/OrionEp11-001-NA.mp3,001,NA,NA,専門を深めるべきか？視野を広げるべきか？
projects/OrionEp11/サウンド類/Narration/OrionEp11-002-NA.mp3,002,NA,NA,キャリアプランの迷いは、優柔不断なのか、それとも時代の要請なのか？
projects/OrionEp11/サウンド類/Narration/OrionEp11-003-NA.mp3,003,NA,NA,ルネサンスに現れた万能の天才と、群雄割拠時代を席巻した獅子と狐の戦略から、『深さと広さの螺旋』を描く8分間。
projects/OrionEp11/サウンド類/Narration/OrionEp11-004-NA.mp3,004,NA,NA,深夜のオフィス。デスクには二つの本が並んでいます。『専門性を極める技術』と『リベラルアーツの教養』。
projects/OrionEp11/サウンド類/Narration/OrionEp11-005-NA.mp3,005,NA,NA,どちらを読むべきか。いや、どちらの道を選ぶべきか——
projects/OrionEp11/サウンド類/Narration/OrionEp11-006-NA.mp3,006,NA,NA,転職サイトには「スペシャリスト募集」と「ゼネラリスト歓迎」の文字が混在している。
projects/OrionEp11/サウンド類/Narration/OrionEp11-007-NA.mp3,007,NA,NA,ようこそ、オリオンの会議室へ。今夜のテーマは「スペシャリストかゼネラリストか」。
projects/OrionEp11/サウンド類/Narration/OrionEp11-008-NA.mp3,008,NA,NA,今夜結ぶのは、こんな星座。
projects/OrionEp11/サウンド類/Narration/OrionEp11-009-NA.mp3,009,NA,NA,絵画も解剖学も極めたレオナルド・ダ・ヴィンチ、獅子と狐の使い分けを説いたマキャヴェリ、「智と情」の間で揺れた夏目漱石、認知的柔軟性を研究する脳科学者たち——
projects/OrionEp11/サウンド類/Narration/OrionEp11-010-NA.mp3,010,NA,NA,万能と専門、広さと深さ。一見矛盾する星々が、現代のキャリア論でひとつの物語を紡ぎ始めます。
projects/OrionEp11/サウンド類/Narration/OrionEp11-011-NA.mp3,011,NA,NA,人事評価の季節。上司との面談。
projects/OrionEp11/サウンド類/Narration/OrionEp11-012-DL.mp3,012,DL,上司,「君はどっちを目指すんだ？技術のスペシャリスト？それともマネジメント？」
projects/OrionEp11/サウンド類/Narration/OrionEp11-013-NA.mp3,013,NA,NA,答えに詰まります。プログラミングも好き、でもプロジェクト全体を見るのも楽しい。
projects/OrionEp11/サウンド類/Narration/OrionEp11-014-NA.mp3,014,NA,NA,同期の山田は、機械学習一筋。国際学会で発表するレベル。同期の佐藤は、営業から企画、開発まで何でもこなす。どちらも評価されている。
projects/OrionEp11/サウンド類/Narration/OrionEp11-015-DL.mp3,015,DL,内なる声,「私は...中途半端なのかもしれない」
projects/OrionEp11/サウンド類/Narration/OrionEp11-016-NA.mp3,016,NA,NA,T型人材、π型人材、最近では「くし型人材」なんて言葉も。キャリアの「型」は増える一方で、自分の型が見えなくなっていく。
projects/OrionEp11/サウンド類/Narration/OrionEp11-017-NA.mp3,017,NA,NA,15世紀のフィレンツェ。一人の男が、人類史上最も多才な人物として活躍していました。
projects/OrionEp11/サウンド類/Narration/OrionEp11-018-NA.mp3,018,NA,NA,レオナルド・ダ・ヴィンチ。
projects/OrionEp11/サウンド類/Narration/OrionEp11-019-NA.mp3,019,NA,NA,モナリザを描いた画家？最後の晩餐の作者？いいえ、それは彼のほんの一面に過ぎません。
projects/OrionEp11/サウンド類/Narration/OrionEp11-020-NA.mp3,020,NA,NA,解剖学者として多数の人体を解剖し詳細な解剖図を残し、工学者として飛行機械を設計、建築家として理想都市を構想、音楽家として竪琴を演奏——
projects/OrionEp11/サウンド類/Narration/OrionEp11-021-DL.mp3,021,DL,ダ・ヴィンチ,「すべては繋がっている。人体の構造を知らずして、どうして人を描けようか」
projects/OrionEp11/サウンド類/Narration/OrionEp11-022-NA.mp3,022,NA,NA,彼にとって、専門の境界は存在しませんでした。解剖学の知識が絵画を深め、絵画の観察眼が工学設計を助ける。
projects/OrionEp11/サウンド類/Narration/OrionEp11-023-NA.mp3,023,NA,NA,しかし、ここで重要な事実があります。ダ・ヴィンチは同時にすべてを学んだのではない。
projects/OrionEp11/サウンド類/Narration/OrionEp11-024-NA.mp3,024,NA,NA,若い頃は絵画に没頭。30代で解剖学、40代で工学——螺旋を描くように、一つの専門が次の専門への扉を開いていったのです。
projects/OrionEp11/サウンド類/Narration/OrionEp11-025-NA.mp3,025,NA,NA,そして彼のノートには、こんな言葉が残されています。
projects/OrionEp11/サウンド類/Narration/OrionEp11-026-NA.mp3,026,NA,NA,「完璧を求めるあまり、何も完成させられない」
projects/OrionEp11/サウンド類/Narration/OrionEp11-027-NA.mp3,027,NA,NA,万能の天才も、すべてを極めることの不可能性を知っていました。
projects/OrionEp11/サウンド類/Narration/OrionEp11-028-NA.mp3,028,NA,NA,同じルネサンス期、フィレンツェの政治家マキャヴェリは、別の視点を提供します。
projects/OrionEp11/サウンド類/Narration/OrionEp11-029-NA.mp3,029,NA,NA,『君主論』で彼は、理想の指導者について独特の比喩を用いました。
projects/OrionEp11/サウンド類/Narration/OrionEp11-030-DL.mp3,030,DL,マキャヴェリ,「君主は獅子であると同時に狐でなければならない。獅子は罠を見破れず、狐は狼を追い払えない」
projects/OrionEp11/サウンド類/Narration/OrionEp11-031-NA.mp3,031,NA,NA,獅子の力と狐の知恵——マキャヴェリはこの比喩で、力と策略、専門性と柔軟性の両面の必要性を説いたとされます。
projects/OrionEp11/サウンド類/Narration/OrionEp11-032-NA.mp3,032,NA,NA,マキャヴェリが示唆するのは、「どちらか」ではなく「使い分け」という第三の道。
projects/OrionEp11/サウンド類/Narration/OrionEp11-033-NA.mp3,033,NA,NA,状況によって獅子になり、必要に応じて狐になる。深さと広さは、固定的な属性ではなく、戦略的に選択するモードなのです。
projects/OrionEp11/サウンド類/Narration/OrionEp11-034-NA.mp3,034,NA,NA,明治の日本。夏目漱石は『草枕』の冒頭で、人生の難しさを詩的に表現しました。
projects/OrionEp11/サウンド類/Narration/OrionEp11-035-DL.mp3,035,DL,漱石の言葉,「智に働けば角が立つ。情に棹させば流される。意地を通せば窮屈だ」
projects/OrionEp11/サウンド類/Narration/OrionEp11-036-NA.mp3,036,NA,NA,専門性を追求すれば視野が狭まる。幅広く学べば深みがなくなる。このジレンマを、漱石は人生の本質として受け入れました。
projects/OrionEp11/サウンド類/Narration/OrionEp11-037-NA.mp3,037,NA,NA,興味深いのは、漱石自身のキャリアです。
projects/OrionEp11/サウンド類/Narration/OrionEp11-038-NA.mp3,038,NA,NA,英文学者として出発し、小説家となり、漢詩も詠み、絵も描いた。しかし彼は「万能」を目指したのではない。それぞれの時期に、それぞれの表現を必要としたのです。
projects/OrionEp11/サウンド類/Narration/OrionEp11-039-NA.mp3,039,NA,NA,日本には「一芸に通ずるは万芸に通ず」という言葉があります。これは世阿弥の『花鏡』にも見られる考え方で、一つを極めることで見えてくる普遍的な原理が、他の分野にも応用できるという洞察です。
projects/OrionEp11/サウンド類/Narration/OrionEp11-040-NA.mp3,040,NA,NA,進化生物学で知られる「適応放散」は、この考え方を裏付けています。
projects/OrionEp11/サウンド類/Narration/OrionEp11-041-NA.mp3,041,NA,NA,ダーウィンの研究で有名なガラパゴス諸島のフィンチ。たった一種の祖先から、環境に応じてくちばしの形が異なる多様な種が進化しました。これは、環境に応じて特化と汎化を使い分ける戦略の好例です。
projects/OrionEp11/サウンド類/Narration/OrionEp11-042-NA.mp3,042,NA,NA,最も成功した種は、特化できる能力と、必要に応じて汎化できる可塑性、両方を持っていました。環境が安定している時は特化が有利。しかし環境が激変する時は、ジェネラリストが生き残る。
projects/OrionEp11/サウンド類/Narration/OrionEp11-043-NA.mp3,043,NA,NA,これは現代のキャリアにも当てはまります。産業が安定していた20世紀は、スペシャリゼーションが重視されました。しかしVUCAの21世紀は、状況に応じて特化と汎化を切り替える「適応的キャリア」が求められています。
projects/OrionEp11/サウンド類/Narration/OrionEp11-044-NA.mp3,044,NA,NA,ノーベル賞受賞者のキャリアパスを分析した研究によると、若い時期に一つの分野を深め、その後関連分野に展開し、新しい統合を生み出すパターンが見られるという報告もあります。
projects/OrionEp11/サウンド類/Narration/OrionEp11-045-NA.mp3,045,NA,NA,まるで、進化が教える生存戦略を、無意識に実践しているかのようです。
projects/OrionEp11/サウンド類/Narration/OrionEp11-046-NA.mp3,046,NA,NA,では、私たちはどう考えればいいのでしょうか。
projects/OrionEp11/サウンド類/Narration/OrionEp11-047-NA.mp3,047,NA,NA,ダ・ヴィンチが示すのは、すべてが繋がっているという視点。専門性は孤立したものではなく、他の知識と結びついて初めて花開く。
projects/OrionEp11/サウンド類/Narration/OrionEp11-048-NA.mp3,048,NA,NA,マキャヴェリの獅子と狐は、状況に応じた使い分けの知恵。プレゼンでは狐のように広く、実装では獅子のように深く。
projects/OrionEp11/サウンド類/Narration/OrionEp11-049-NA.mp3,049,NA,NA,漱石の「角が立つ」は、バランスの難しさの認識。完璧な「型」など存在しない。むしろ、その揺らぎの中に創造性が宿る。
projects/OrionEp11/サウンド類/Narration/OrionEp11-050-NA.mp3,050,NA,NA,脳科学が教えるのは、固定観念からの解放。T型でもπ型でもなく、あなた独自の「変幻自在型」でいい。
projects/OrionEp11/サウンド類/Narration/OrionEp11-051-NA.mp3,051,NA,NA,重要なのは、今この瞬間、何に集中すべきかを見極めること。そして、その選択に罪悪感を持たないこと。
projects/OrionEp11/サウンド類/Narration/OrionEp11-052-NA.mp3,052,NA,NA,次の人事面談。上司の質問に、今度は迷いません。
projects/OrionEp11/サウンド類/Narration/OrionEp11-053-DL.mp3,053,DL,あなた,「今は機械学習を深めます。でも、それはゴールではなく、次への入り口だと思っています」
projects/OrionEp11/サウンド類/Narration/OrionEp11-054-DL.mp3,054,DL,上司,「なるほど、君なりの成長戦略があるんだね」
projects/OrionEp11/サウンド類/Narration/OrionEp11-055-NA.mp3,055,NA,NA,スペシャリストかゼネラリストか——その問い自体が間違っていたのかもしれません。
projects/OrionEp11/サウンド類/Narration/OrionEp11-056-NA.mp3,056,NA,NA,人生は長い。時期によって深め、時期によって広げる。螺旋階段のように、上昇しながら視野を広げていく。
projects/OrionEp11/サウンド類/Narration/OrionEp11-057-NA.mp3,057,NA,NA,夜空を見上げると、オリオン座が輝いています。
projects/OrionEp11/サウンド類/Narration/OrionEp11-058-NA.mp3,058,NA,NA,オリオンの三つ星は、それぞれ異なる恒星。距離も、大きさも、温度も違う。でも地球から見ると、美しい直線を描いています。
projects/OrionEp11/サウンド類/Narration/OrionEp11-059-NA.mp3,059,NA,NA,あなたのキャリアも、今は点在する専門知識かもしれません。でも、いつか振り返った時、それらが美しい星座を描いていることに気づくでしょう。
projects/OrionEp11/サウンド類/Narration/OrionEp11-060-NA.mp3,060,NA,NA,ダ・ヴィンチの万能性、マキャヴェリの戦略性、漱石の文学性——異なる才能が、時代を超えて私たちに語りかけています。
projects/OrionEp11/サウンド類/Narration/OrionEp11-061-NA.mp3,061,NA,NA,深さも広さも、どちらも大切。ただし、同時にではなく、人生の異なる季節に。
projects/OrionEp11/サウンド類/Narration/OrionEp11-062-NA.mp3,062,NA,NA,知識の星座は、見る人によって違う物語を紡ぎます。
projects/OrionEp11/サウンド類/Narration/OrionEp11-063-NA.mp3,063,NA,NA,あなたは今夜、どんな星座を見つけましたか？
projects/OrionEp11/サウンド類/Narration/OrionEp11-064-NA.mp3,064,NA,NA,明日、また新しい本を手に取る時、それが専門書でも教養書でも、あなたの星座の新しい一つの星になることを信じて。
