filename,number,role,character,text
projects/OrionEp5/サウンド類/Narration/OrionEp5-001-NA.mp3,001,NA,NA,朝5時起き、ジム、副業、資格勉強——SNSの「頑張ってる投稿」を見て焦ったことはありませんか？
projects/OrionEp5/サウンド類/Narration/OrionEp5-002-NA.mp3,002,NA,NA,この努力は、成長への道なのか、それとも自分を追い詰める呪縛なのか？
projects/OrionEp5/サウンド類/Narration/OrionEp5-003-NA.mp3,003,NA,NA,無為を説いた老子と、フロー体験を発見した心理学者が示す、『頑張らずに成果を出す』逆説的な知恵を探る8分間。
projects/OrionEp5/サウンド類/Narration/OrionEp5-004-NA.mp3,004,NA,NA,朝6時のオフィス街。すでに歩く人々の姿がちらほら。スマホには自己啓発系インフルエンサーの投稿が流れてきます。
projects/OrionEp5/サウンド類/Narration/OrionEp5-005-NA.mp3,005,NA,NA,「今日も5時起きで朝活！」「休日こそ成長のチャンス！」——そんな言葉を見るたびに、胸の奥がざわつく。
projects/OrionEp5/サウンド類/Narration/OrionEp5-006-NA.mp3,006,NA,NA,頑張っているはずなのに、なぜか前に進んでいない気がする。
projects/OrionEp5/サウンド類/Narration/OrionEp5-007-NA.mp3,007,NA,NA,ようこそ、オリオンの会議室へ。今夜のテーマは「頑張らない技術」。
projects/OrionEp5/サウンド類/Narration/OrionEp5-008-NA.mp3,008,NA,NA,今夜結ぶのは、こんな星座。
projects/OrionEp5/サウンド類/Narration/OrionEp5-009-NA.mp3,009,NA,NA,無為を説いた老子、フロー体験を研究した心理学者チクセントミハイ、情報理論の父クロード・シャノン、そして無常の中に安らぎを見出した鴨長明——
projects/OrionEp5/サウンド類/Narration/OrionEp5-010-NA.mp3,010,NA,NA,時代も大陸も越えた星々が、「努力と成果」という見えない糸で、新しい物語を紡ぎ始めます。
projects/OrionEp5/サウンド類/Narration/OrionEp5-011-NA.mp3,011,NA,NA,月曜日の朝礼。マネージャーの熱い檄が飛びます。
projects/OrionEp5/サウンド類/Narration/OrionEp5-012-DL.mp3,012,DL,マネージャー,「今週もアグレッシсивに！とりあえず動こう！」
projects/OrionEp5/サウンド類/Narration/OrionEp5-013-NA.mp3,013,NA,NA,でも、チームの顔に疲れが見える。先週も、その前も、ずっと「とりあえず動いて」きた。
projects/OrionEp5/サウンド類/Narration/OrionEp5-014-NA.mp3,014,NA,NA,スプリントレビュー、振り返り、そしてまた次のスプリント。アジャイル開発の名の下に、息つく暇もない日々。
projects/OrionEp5/サウンド類/Narration/OrionEp5-015-NA.mp3,015,NA,NA,深夜、独りデスクに向かいながら、ふと思います。
projects/OrionEp5/サウンド類/Narration/OrionEp5-016-DL.mp3,016,DL,内なる声,「こんなに頑張っているのに、なぜ成果が出ないんだろう」
projects/OrionEp5/サウンド類/Narration/OrionEp5-017-NA.mp3,017,NA,NA,努力は美徳。でも、その努力が空回りしている時、私たちはどうすればいいのでしょうか。
projects/OrionEp5/サウンド類/Narration/OrionEp5-018-NA.mp3,018,NA,NA,紀元前6世紀の中国。老子という賢者が、当時の常識を覆す思想を説きました。
projects/OrionEp5/サウンド類/Narration/OrionEp5-019-NA.mp3,019,NA,NA,「無為自然」——何もしないことが、最も自然な行為である。
projects/OrionEp5/サウンド類/Narration/OrionEp5-020-NA.mp3,020,NA,NA,これを怠惰と誤解してはいけません。老子が説いたのは、もっと深い智慧でした。
projects/OrionEp5/サウンド類/Narration/OrionEp5-021-DL.mp3,021,DL,老子,「上善は水の如し。水は万物を利して争わず」
projects/OrionEp5/サウンド類/Narration/OrionEp5-022-NA.mp3,022,NA,NA,水は争わない。岩にぶつかれば、その周りを流れていく。でも、長い時間をかけて、水は岩を削り、谷を作り、大地を変えていく。
projects/OrionEp5/サウンド類/Narration/OrionEp5-023-NA.mp3,023,NA,NA,無為とは「何もしない」ことではなく、「無理をしない」こと。自然の流れに逆らわず、その力を借りること。
projects/OrionEp5/サウンド類/Narration/OrionEp5-024-NA.mp3,024,NA,NA,興味深いのは、老子が生きた春秋戦国時代は、まさに競争と戦乱の時代だったということ。
projects/OrionEp5/サウンド類/Narration/OrionEp5-025-NA.mp3,025,NA,NA,みんなが力で押し通そうとする中で、老子は「柔よく剛を制す」と説きました。
projects/OrionEp5/サウンド類/Narration/OrionEp5-026-NA.mp3,026,NA,NA,赤ちゃんを見てください。彼らは「頑張って」いません。でも、驚異的な速度で成長していく。それは、自然の成長プログラムに身を委ねているから。
projects/OrionEp5/サウンド類/Narration/OrionEp5-027-NA.mp3,027,NA,NA,現代の私たちは、この自然なリズムを忘れてしまったのかもしれません。
projects/OrionEp5/サウンド類/Narration/OrionEp5-028-NA.mp3,028,NA,NA,20世紀後半、ハンガリー出身の心理学者ミハイ・チクセントミハイが、ある興味深い現象を発見しました。
projects/OrionEp5/サウンド類/Narration/OrionEp5-029-NA.mp3,029,NA,NA,「フロー体験」——完全に活動に没頭し、時間を忘れ、自己意識が消える瞬間。
projects/OrionEp5/サウンド類/Narration/OrionEp5-030-NA.mp3,030,NA,NA,芸術家、アスリート、プログラマー。最高のパフォーマンスを発揮する人々に共通していたのは、「頑張っている」感覚がないことでした。
projects/OrionEp5/サウンド類/Narration/OrionEp5-031-NA.mp3,031,NA,NA,フロー状態では、努力感なく最高の成果が生まれる。まるで、老子の無為自然と響き合うかのようです。
projects/OrionEp5/サウンド類/Narration/OrionEp5-032-NA.mp3,032,NA,NA,さらに興味深いのは、情報理論の父クロード・シャノンの洞察です。
projects/OrionEp5/サウンド類/Narration/OrionEp5-033-NA.mp3,033,NA,NA,彼は「創造的思考」について、こう語りました。「最も重要なアイデアは、リラックスしている時に浮かぶ。シャワーを浴びている時、散歩している時——」
projects/OrionEp5/サウンド類/Narration/OrionEp5-034-NA.mp3,034,NA,NA,努力と成果は、必ずしも比例しない。むしろ、力を抜いた時にこそ、ブレイクスルーが起きる。
projects/OrionEp5/サウンド類/Narration/OrionEp5-035-NA.mp3,035,NA,NA,21世紀の物理学が、老子の直観を裏付けているかもしれません。
projects/OrionEp5/サウンド類/Narration/OrionEp5-036-NA.mp3,036,NA,NA,「最小作用の原理」——自然界のあらゆる現象は、最も効率的な経路を選ぶという法則。
projects/OrionEp5/サウンド類/Narration/OrionEp5-037-NA.mp3,037,NA,NA,光は最短時間で進む経路を選び、水は最も抵抗の少ない道を流れ、惑星は最小のエネルギーで軌道を描く。
projects/OrionEp5/サウンド類/Narration/OrionEp5-038-NA.mp3,038,NA,NA,自然は決して無駄な努力をしません。常に最もエレガントな解を選ぶ。これは怠惰ではなく、究極の効率性。
projects/OrionEp5/サウンド類/Narration/OrionEp5-039-NA.mp3,039,NA,NA,エネルギー保存則も同じことを示しています。エネルギーは創造も消滅もせず、ただ形を変えるだけ。つまり、無理に力を使えば、どこかで必ずその反動が来る。持続可能なシステムは、エネルギーを賢く循環させるシステムなのです。
projects/OrionEp5/サウンド類/Narration/OrionEp5-040-NA.mp3,040,NA,NA,強制された努力ではなく、自然な好奇心に従った探求。それが最も効率的にイノベーションを生む——まさに最小作用の原理の、組織版実装です。
projects/OrionEp5/サウンド類/Narration/OrionEp5-041-NA.mp3,041,NA,NA,鎌倉時代、鴨長明は『方丈記』で無常の世を描きました。
projects/OrionEp5/サウンド類/Narration/OrionEp5-042-NA.mp3,042,NA,NA,京都で大火事、地震、飢饉を経験した鴨長明。彼は都を離れ、小さな庵で暮らし始めます。
projects/OrionEp5/サウンド類/Narration/OrionEp5-043-DL.mp3,043,DL,鴨長明,「ゆく河の流れは絶えずして、しかももとの水にあらず」
projects/OrionEp5/サウンド類/Narration/OrionEp5-044-NA.mp3,044,NA,NA,すべては移り変わる。だからこそ、流れに逆らわず、その時々を大切に生きる。
projects/OrionEp5/サウンド類/Narration/OrionEp5-045-NA.mp3,045,NA,NA,これは諦めではありません。むしろ、変化を受け入れることで、新しい可能性が開かれるという洞察。
projects/OrionEp5/サウンド類/Narration/OrionEp5-046-NA.mp3,046,NA,NA,現代の私たちは、変化を恐れ、コントロールしようとして疲弊しています。でも、川の流れに身を任せる方が、はるかに遠くまで行けるのかもしれません。
projects/OrionEp5/サウンド類/Narration/OrionEp5-047-NA.mp3,047,NA,NA,まず、自分の自然なリズムを見つけること。朝型の人もいれば、夜型の人もいる。それを無視して「朝5時起き」を強制しても、パフォーマンスは上がりません。
projects/OrionEp5/サウンド類/Narration/OrionEp5-048-NA.mp3,048,NA,NA,次に、休息を「生産性の一部」として組み込むこと。デフォルト・モード・ネットワーク——意識的な課題に取り組んでいない時に活性化する脳のネットワーク——が働く時間がなければ、創造性は枯渇します。
projects/OrionEp5/サウンド類/Narration/OrionEp5-049-NA.mp3,049,NA,NA,そして、「流れ」を感じること。抵抗が大きすぎる時は、方向が間違っているサイン。水のように、抵抗の少ない道を探す。
projects/OrionEp5/サウンド類/Narration/OrionEp5-050-NA.mp3,050,NA,NA,これは怠惰への言い訳ではありません。むしろ、最も効果的な努力の方法を見つけること。
projects/OrionEp5/サウンド類/Narration/OrionEp5-051-NA.mp3,051,NA,NA,頑張らないことで、最大の成果を生む。この逆説的な真実を、2500年前の老子も、現代の脳科学も、それぞれの方法で指し示しています。
projects/OrionEp5/サウンド類/Narration/OrionEp5-052-NA.mp3,052,NA,NA,火曜日の午後3時。いつもなら無理やりカフェインで覚醒させる時間。
projects/OrionEp5/サウンド類/Narration/OrionEp5-053-NA.mp3,053,NA,NA,でも今日は違います。15分の散歩に出てみる。
projects/OrionEp5/サウンド類/Narration/OrionEp5-054-NA.mp3,054,NA,NA,オフィスビルの周りを歩きながら、頭の中がクリアになっていくのを感じます。戻ってきた時、昨日まで解けなかった問題の答えが、ふと浮かんでいました。
projects/OrionEp5/サウンド類/Narration/OrionEp5-055-DL.mp3,055,DL,同僚,「どうしたの？すごくリラックスして見える」
projects/OrionEp5/サウンド類/Narration/OrionEp5-056-DL.mp3,056,DL,あなた,「頑張るのをやめてみたんです」
projects/OrionEp5/サウンド類/Narration/OrionEp5-057-NA.mp3,057,NA,NA,これは皮肉ではなく、新しい働き方の始まり。
projects/OrionEp5/サウンド類/Narration/OrionEp5-058-NA.mp3,058,NA,NA,夜空を見上げると、オリオン座が輝いています。
projects/OrionEp5/サウンド類/Narration/OrionEp5-059-NA.mp3,059,NA,NA,星は頑張って輝いているわけではありません。ただ、その本質に従って、自然に光を放っている。
projects/OrionEp5/サウンド類/Narration/OrionEp5-060-NA.mp3,060,NA,NA,老子の「無為自然」、チクセントミハイの「フロー」、デフォルト・モード・ネットワーク——異なる時代、異なる文化が、同じ真実を違う角度から照らし出しています。
projects/OrionEp5/サウンド類/Narration/OrionEp5-061-NA.mp3,061,NA,NA,「頑張る」ことが美徳とされる社会で、「頑張らない」勇気を持つこと。それは、より大きな成果への、最短の道かもしれません。
projects/OrionEp5/サウンド類/Narration/OrionEp5-062-NA.mp3,062,NA,NA,知識の星座は、見る人によって違う物語を紡ぎます。
projects/OrionEp5/サウンド類/Narration/OrionEp5-063-NA.mp3,063,NA,NA,あなたは今夜、どんな星座を見つけましたか？
projects/OrionEp5/サウンド類/Narration/OrionEp5-064-NA.mp3,064,NA,NA,明日の朝、目覚まし時計を5時にセットする前に、一度立ち止まって考えてみてください。その努力は、自然な流れに沿っているでしょうか。
projects/OrionEp5/サウンド類/Narration/OrionEp5-065-NA.mp3,065,NA,NA,そして夜空の星は、何もしないあなたの創造性を、静かに照らし続けています。
